{
  "id": "edge_notpetya_petya_001",
  "from": "malware:notpetya",
  "to": "malware:petya",
  "type": "reported_as_related_to",
  "direction": "directed",
  "confidence": "low",
  "evidence_type": "vendor_report",
  "relation_scope": "reporting",
  "status": "tentative",
  "sources": [
    {
      "source": "source:cloudflare_petya_notpetya",
      "claim": "Cloudflare describes NotPetya as malware that had many similarities to Petya but behaved differently.",
      "claim_scope": "family",
      "locator": "overview"
    },
    {
      "source": "source:mitre_attack_notpetya",
      "claim": "MITRE ATT&CK lists GoldenEye and Petrwrap among NotPetya associated software names and classifies NotPetya as destructive wiper-like malware.",
      "claim_scope": "family",
      "locator": "software description"
    }
  ],
  "curator_note": "Downgraded from variant_of because current public receipts support Petya/NotPetya similarity and naming context, not direct ancestry.",
  "confidence_reason": "Current citations support a reported relationship and surface resemblance, while NotPetya's destructive behavior and historical naming convention make strict variant language too strong.",
  "review_state": "reviewed",
  "relation_qualifier": "explicit_claim",
  "shared_artifact_type": "behavior",
  "created_at": "2026-06-08",
  "updated_at": "2026-06-10"
}
