{
  "id": "edge_clop_cryptomix_001",
  "from": "malware:clop",
  "to": "malware:cryptomix",
  "type": "variant_of",
  "direction": "directed",
  "confidence": "high",
  "evidence_type": "primary_research",
  "relation_scope": "code",
  "status": "accepted",
  "sources": [
    {
      "source": "source:nhs_clop_cryptomix",
      "claim": "NHS Digital states Clop is a variant of the older CryptoMix ransomware.",
      "claim_scope": "family",
      "locator": "alert"
    }
  ],
  "curator_note": "Lineage direction follows descendant to ancestor: Clop -> CryptoMix.",
  "confidence_reason": "Direct variant statement in public cyber alert.",
  "review_state": "reviewed",
  "relation_qualifier": "explicit_claim",
  "shared_artifact_type": "code",
  "created_at": "2026-06-08",
  "updated_at": "2026-06-08"
}
