{
  "id": "edge_latrodectus_icedid_001",
  "from": "malware:latrodectus",
  "to": "malware:icedid",
  "type": "reported_as_related_to",
  "direction": "undirected",
  "confidence": "medium",
  "evidence_type": "vendor_report",
  "relation_scope": "reporting",
  "status": "accepted",
  "sources": [
    {
      "source": "source:proofpoint_latrodectus_2024",
      "claim": "Proofpoint and Team Cymru report Latrodectus is a new malware family likely created by IcedID developers, with infrastructure and operator overlap to historic IcedID operations.",
      "claim_scope": "family",
      "locator": "overview and connection to IcedID"
    }
  ],
  "curator_note": "Modeled as related rather than variant_of or shares_operator_with. The report supports developer, infrastructure, and operator overlap, while explicitly treating Latrodectus as a new malware family.",
  "confidence_reason": "The Proofpoint/Team Cymru report provides direct technical and infrastructure evidence, but this remains a single-source relationship and is intentionally conservative.",
  "review_state": "reviewed",
  "relation_qualifier": "explicit_claim",
  "shared_artifact_type": "operator",
  "created_at": "2026-06-08",
  "updated_at": "2026-06-08"
}
