{
  "id": "edge_black_basta_conti_001",
  "from": "malware:black_basta",
  "to": "malware:conti",
  "type": "shares_operator_with",
  "direction": "undirected",
  "confidence": "medium",
  "evidence_type": "community_report",
  "relation_scope": "operator",
  "status": "tentative",
  "sources": [
    {
      "source": "source:mitre_attack_black_basta",
      "claim": "MITRE ATT&CK says researchers assess Black Basta operators could include current or former members of the Conti group.",
      "claim_scope": "operator",
      "locator": "software description"
    }
  ],
  "curator_note": "Tentative because the source describes assessed operator overlap, not code lineage.",
  "confidence_reason": "MITRE records the assessment, but the wording is qualified and operator-focused.",
  "review_state": "reviewed",
  "relation_qualifier": "inferred_from_behavior_similarity",
  "shared_artifact_type": "operator",
  "created_at": "2026-06-08",
  "updated_at": "2026-06-08"
}
