{
  "id": "edge_stealc_mars_001",
  "from": "malware:stealc",
  "to": "malware:mars_stealer",
  "type": "inspired_by",
  "direction": "directed",
  "confidence": "medium",
  "evidence_type": "marketplace_claim",
  "relation_scope": "design",
  "status": "tentative",
  "sources": [
    {
      "source": "source:sekoia_stealc_part_1",
      "claim": "Sekoia reports that Plymouth presented Stealc as relying on Vidar, Raccoon, Mars, and RedLine.",
      "claim_scope": "family",
      "locator": "context"
    }
  ],
  "curator_note": "Tentative because this is a developer/marketplace-origin influence claim, not verified code ancestry.",
  "confidence_reason": "The source claim is explicit, but it originates from the alleged developer's positioning.",
  "review_state": "reviewed",
  "relation_qualifier": "marketplace_claim",
  "shared_artifact_type": "unknown",
  "created_at": "2026-06-06",
  "updated_at": "2026-06-06"
}
