{
  "id": "edge_duqu_stuxnet_001",
  "from": "malware:duqu",
  "to": "malware:stuxnet",
  "type": "shares_code_with",
  "direction": "undirected",
  "confidence": "high",
  "evidence_type": "code_similarity",
  "relation_scope": "code",
  "status": "accepted",
  "sources": [
    {
      "source": "source:enisa_duqu_briefing",
      "claim": "ENISA summarizes reporting that large sections of Duqu code are similar to Stuxnet code.",
      "claim_scope": "family",
      "locator": "briefing note"
    },
    {
      "source": "source:kaspersky_gauss_securelist_2012",
      "claim": "Kaspersky describes Duqu as based on the Tilded platform on which Stuxnet was developed.",
      "claim_scope": "family",
      "locator": "Gauss FAQ introduction"
    }
  ],
  "curator_note": "Modeled as code sharing rather than direct lineage because public reporting supports common/source-code access but not a simple descendant claim.",
  "confidence_reason": "ENISA summarizes Duqu/Stuxnet code similarity, and Kaspersky provides additional platform-level evidence tying Duqu and Stuxnet to the Tilded platform.",
  "review_state": "reviewed",
  "relation_qualifier": "explicit_claim",
  "shared_artifact_type": "code",
  "similarity": {
    "method": "manual_reverse_engineering",
    "scope": "family"
  },
  "created_at": "2026-06-08",
  "updated_at": "2026-06-08"
}
