{
  "id": "edge_blackmatter_darkside_001",
  "from": "malware:blackmatter",
  "to": "malware:darkside",
  "type": "reported_as_related_to",
  "direction": "undirected",
  "confidence": "medium",
  "evidence_type": "primary_research",
  "relation_scope": "reporting",
  "status": "tentative",
  "sources": [
    {
      "source": "source:cisa_blackmatter_2021",
      "claim": "CISA, FBI, and NSA state BlackMatter is a possible rebrand of DarkSide.",
      "claim_scope": "family",
      "locator": "note"
    }
  ],
  "curator_note": "Tentative because the source uses possible rebrand language.",
  "confidence_reason": "The relationship is directly stated by a government advisory, but explicitly qualified.",
  "review_state": "reviewed",
  "relation_qualifier": "explicit_claim",
  "shared_artifact_type": "operator",
  "created_at": "2026-06-08",
  "updated_at": "2026-06-08"
}
