{
  "id": "edge_whispergate_hermeticwiper_001",
  "from": "malware:whispergate",
  "to": "malware:hermeticwiper",
  "type": "targets_same_ecosystem_as",
  "direction": "undirected",
  "confidence": "medium",
  "evidence_type": "primary_research",
  "relation_scope": "targeting",
  "status": "accepted",
  "sources": [
    {
      "source": "source:cisa_fbi_ukraine_destructive_malware_2022",
      "claim": "CISA and FBI cover WhisperGate and HermeticWiper in the same advisory on destructive malware deployed against Ukrainian organizations.",
      "claim_scope": "campaign",
      "locator": "summary"
    },
    {
      "source": "source:eset_caddywiper_2022",
      "claim": "ESET identifies WhisperGate as a January 2022 Ukraine data wiper and HermeticWiper as a later high-profile Ukraine wiper campaign.",
      "claim_scope": "campaign",
      "locator": "Ukraine in the crosshairs"
    },
    {
      "source": "source:microsoft_whispergate_2022",
      "claim": "Microsoft documents WhisperGate as destructive malware against Ukrainian organizations in January 2022.",
      "claim_scope": "campaign",
      "locator": "overview"
    }
  ],
  "curator_note": "Shared target/campaign ecosystem only. No code, actor, or direct lineage claim is implied.",
  "confidence_reason": "Public advisory and vendor reporting support common Ukraine destructive-malware context, but not a direct family relationship.",
  "review_state": "reviewed",
  "relation_qualifier": "explicit_claim",
  "shared_artifact_type": "campaign",
  "created_at": "2026-06-08",
  "updated_at": "2026-06-08"
}
