{
  "id": "edge_egregor_maze_001",
  "from": "malware:egregor",
  "to": "malware:maze",
  "type": "reported_as_related_to",
  "direction": "undirected",
  "confidence": "medium",
  "evidence_type": "vendor_report",
  "relation_scope": "reporting",
  "status": "accepted",
  "sources": [
    {
      "source": "source:nhs_egregor_2020",
      "claim": "NHS Digital reports Egregor appears to have been adopted by Maze operators and affiliates after Maze shut down, while noting Maze authorship is unclear.",
      "claim_scope": "operator",
      "locator": "summary and introduction"
    },
    {
      "source": "source:sophos_egregor_maze_heir_2020",
      "claim": "Sophos says Egregor emerged as Maze shut down and followed Maze's extortion model, but that Egregor code is not a Maze derivative.",
      "claim_scope": "family",
      "locator": "article body"
    },
    {
      "source": "source:mitre_attack_egregor",
      "claim": "MITRE ATT&CK notes researchers have reported code similarities between Egregor, Sekhmet, and Maze.",
      "claim_scope": "family",
      "locator": "software description"
    }
  ],
  "curator_note": "Modeled as related reporting rather than lineage. Sophos explicitly cautions that Egregor is not a direct derivative of Maze, while NHS supports Maze operator or affiliate adoption.",
  "confidence_reason": "Multiple public sources connect Egregor to Maze through timing, operator or affiliate transition, behavioral continuity, and reported similarity, but the direct authorship and lineage claims remain qualified.",
  "review_state": "reviewed",
  "relation_qualifier": "explicit_claim",
  "shared_artifact_type": "operator",
  "created_at": "2026-06-08",
  "updated_at": "2026-06-08"
}
