{
  "id": "edge_xloader_formbook_001",
  "from": "malware:xloader",
  "to": "malware:formbook",
  "type": "derived_from",
  "direction": "directed",
  "confidence": "high",
  "evidence_type": "code_similarity",
  "relation_scope": "code",
  "status": "accepted",
  "sources": [
    {
      "source": "source:checkpoint_formbook_xloader_macos_2021",
      "claim": "Check Point Research reports that FormBook was reborn as XLoader and that FormBook and XLoader share the same code base.",
      "claim_scope": "family",
      "locator": "XLoader section"
    },
    {
      "source": "source:zscaler_xloader_obfuscation_2023",
      "claim": "Zscaler reports XLoader is a rebranded FormBook line and documents algorithms shared between FormBook and XLoader versions.",
      "claim_scope": "family",
      "locator": "key takeaways, introduction, and basic algorithms"
    },
    {
      "source": "source:mitre_attack_xloader",
      "claim": "MITRE ATT&CK describes XLoader as previously known and sometimes still referred to as Formbook, with Formbook listed as associated software.",
      "claim_scope": "family",
      "locator": "software description"
    }
  ],
  "curator_note": "Modeled as derived_from rather than alias_of because public reverse-engineering sources describe a successor/rebrand with shared code and changed business model. MITRE's associated-name treatment is preserved in node aliases and source notes.",
  "confidence_reason": "Check Point and Zscaler both provide direct successor/rebrand language and technical shared-code context; MITRE corroborates the naming association.",
  "review_state": "reviewed",
  "relation_qualifier": "explicit_claim",
  "shared_artifact_type": "code",
  "similarity": {
    "method": "manual_reverse_engineering",
    "scope": "family"
  },
  "created_at": "2026-06-08",
  "updated_at": "2026-06-08"
}
